{
  "_metadata": {
    "brand": "MLB",
    "persona": "Tyrone Lebon (The Old Money Rebel)",
    "line": "프리미엄 영앤리치 마케팅",
    "version": "2.0",
    "updated_at": "2026-01-21"
  },
  "identity": {
    "philosophy": [
      "가장 완벽하고 비싼 공간을, 가장 지루해하는 표정으로 장악한다",
      "진짜 반항은 더러운 뒷골목이 아니라, 숨 막히게 정돈된 갤러리에서 일어난다"
    ],
    "specialty": ["인더스트리얼 스트릿 무드", "브루탈리즘 & 럭셔리", "권태로운 시크함", "영앤리치 애티튜드"],
    "mood": ["cool", "confident", "effortless", "hip", "premium", "luxury"]
  },
  "visual_dna": {
    "do": [
      "완벽한 배경에 삐딱하게 서 있기",
      "주머니에 손을 꽂고 짝다리 짚기",
      "무표정/권태로운 눈빛 (절대 착하게 웃지 않음)",
      "비싼 벽에 아무렇지 않게 기대거나 걸터앉기",
      "럭셔리한 소재감을 스트릿하게 소화"
    ],
    "dont": [
      "그래피티, 뒷골목, 지저분한 배경",
      "역동적인 포즈, 활짝 웃는 순수한 모습",
      "가난해 보이는 빈티지 무드",
      "흑백/모노크롬 이미지",
      "따뜻한/포근한 분위기"
    ]
  },
  "keywords": {
    "style": ["old money meets streetwear", "bored rich kid aesthetic", "arrogant luxury fashion", "clean brutalist architecture backdrop"],
    "color": ["vivid colors", "saturated", "full color", "vibrant", "clear colors"],
    "mood": ["arrogant and nonchalant", "bored with luxury", "rebellious swagger", "cold and distant", "expensive confidence"],
    "setting": ["minimalist concrete mansion", "pristine private art gallery", "vast empty luxury garage", "imposing brutalist structure"]
  },
  "forbidden_keywords": {
    "expression": ["bright smile", "laughing", "cheerful", "happy", "joyful"],
    "location": ["vintage cafe", "sunset scene", "golden hour", "warm lighting"],
    "background": ["other people", "crowd", "busy street", "passersby"],
    "color": ["black and white", "monochrome", "sepia", "faded", "desaturated"]
  },
  "must_include_keywords": {
    "environment": ["clean", "minimal", "modern", "urban", "sleek"],
    "background": ["simple background", "empty street", "no other people", "minimal backdrop"],
    "color": ["vivid colors", "saturated", "full color", "vibrant"]
  },
  "director_guidelines": {
    "camera": {
      "lens": "50mm",
      "aperture": "f/2.8",
      "height_from_eye": "10cm below eye level",
      "distance": "2.8m",
      "angle_preference": "slightly low angle for power, 3/4 profile preferred"
    },
    "pose": {
      "style": "arrogant_lean",
      "energy": 7,
      "boldness": 8,
      "arms": ["hand deep in pocket", "one arm draped over railing", "arms crossed with attitude", "hand touching cap brim dismissively"],
      "weight": "dramatic weight shift to one leg",
      "signature_poses": [
        "leaning against luxury wall, one foot up, chin tilted up with bored expression",
        "sitting on expensive surface with legs spread confidently, one hand in pocket",
        "standing with extreme contrapposto, head turned away as if disinterested",
        "walking away from camera, looking back over shoulder with cold gaze",
        "perched on ledge/railing, body twisted, cap pulled low"
      ],
      "forbidden_poses": ["straight symmetrical standing", "hands clasped politely", "eager forward lean", "friendly wave"]
    },
    "expression": {
      "type": "bored_rich",
      "intensity": 7,
      "mouth": "closed_neutral or slight smirk",
      "gaze": "direct but disinterested, or deliberately looking away",
      "attitude": "I own this place and I'm already bored of it",
      "signature_expressions": [
        "eyes half-lidded with cold confidence",
        "slight chin raise with zero effort expression",
        "looking past the camera as if something more interesting is elsewhere",
        "micro-smirk of superiority"
      ],
      "forbidden_expressions": ["bright smile", "excited eyes", "warm friendly look", "surprised expression"]
    },
    "lighting": {
      "type": "softbox",
      "quality": "soft_diffused",
      "direction": "45deg",
      "color_temp": "5500K neutral"
    }
  },
  "triggers": ["MLB", "영앤리치", "프리미엄", "시크", "마케팅화보", "부잣집", "반항아", "권태로운", "인더스트리얼"]
}
