{
  "_metadata": {
    "brand": "Discovery",
    "persona": "Yosuke Aizawa (Technical Utility Master)",
    "line": "프리미엄 라이프스타일 아웃도어",
    "version": "2.0",
    "updated_at": "2026-01-21"
  },
  "identity": {
    "philosophy": [
      "옷을 입는 필드는 모두 디자인의 대상이다",
      "디자인, 실용성, 기술 세 가지 요소를 하나로 융합한다"
    ],
    "specialty": ["테크니컬 유틸리티", "입체 패턴 설계", "고프코어", "기능적 미니멀리즘"],
    "mood": ["sophisticated expedition", "technical calm", "composed adventurer", "utilitarian luxury"]
  },
  "visual_dna": {
    "do": [
      "모던 테크니컬 에스테틱",
      "구조적이고 기능적인 엘레강스",
      "슬릭한 레이어링 시스템",
      "어반-자연 전환 무드",
      "지적인 프리미엄 기어"
    ],
    "dont": [
      "플래시한 네온 컬러",
      "과도한 스트릿 그래피티",
      "지저분하거나 거친 텍스처",
      "시끄럽고 오버사이즈 브랜딩",
      "싸구려 합성 광택"
    ]
  },
  "keywords": {
    "style": ["technical utility", "ergonomic silhouette", "gorpcore aesthetic", "sleek urban outdoor", "contemporary functionalism"],
    "color": ["matte charcoal and slate", "deep olive and forest green", "earthy taupe and beige", "muted steel blue", "monochromatic black and gray"],
    "mood": ["sophisticated expedition", "technical calm", "composed adventurer", "utilitarian luxury", "silent intelligence"],
    "setting": ["modernist architecture in nature", "misty pine forests", "brutalist concrete structures", "minimal mountain landscapes", "clean research base aesthetic"]
  },
  "forbidden_keywords": {
    "color": ["flashy neon", "bright orange", "hot pink"],
    "style": ["messy", "rugged", "oversized branding"],
    "texture": ["cheap synthetic shine", "glossy plastic"]
  },
  "must_include_keywords": {
    "style": ["technical", "functional", "structured", "sleek"],
    "material": ["matte", "technical fabric", "layered"]
  },
  "director_guidelines": {
    "camera": {
      "lens": "35mm wide or 85mm portrait",
      "aperture": "f/4",
      "height_from_eye": "eye level or slightly below",
      "distance": "3-5m for environmental, 2m for detail",
      "angle_preference": "environmental wide showing context, or tight mid-shot for gear detail"
    },
    "pose": {
      "style": "composed_tactical",
      "energy": 6,
      "boldness": 7,
      "arms": ["adjusting hood/collar", "gripping backpack strap", "hands in technical pockets", "one arm resting on vehicle/structure"],
      "weight": "stable wide stance or casual lean against structure",
      "signature_poses": [
        "leaning against industrial concrete wall, one knee bent, checking gear casually",
        "sitting on car hood/trunk with legs dangling, looking into distance",
        "standing at structure edge with wide stance, hands in pockets, wind in jacket",
        "crouching to adjust boot/zipper, showing layering system detail",
        "walking through urban environment, mid-stride, natural movement captured",
        "group composition: models at different heights/positions around structure or vehicle"
      ],
      "forbidden_poses": ["catalog standing with arms at sides", "hands on hips cheerfully", "jumping or overly dynamic action"]
    },
    "expression": {
      "type": "intelligent_calm",
      "intensity": 5,
      "mouth": "closed_relaxed",
      "gaze": "focused on middle distance or technical detail",
      "vibe": "modern explorer who is quietly competent",
      "attitude": "I am prepared for anything but not showing off about it",
      "signature_expressions": [
        "calm focused gaze into middle distance, as if assessing terrain",
        "slight squint with sunglasses pushed up, technical concentration",
        "relaxed but alert expression, the look of someone comfortable in any environment",
        "looking down at gear/detail with quiet satisfaction"
      ],
      "forbidden_expressions": ["excited grin", "surprised look", "dramatic intensity", "cheesy adventure face"]
    },
    "lighting": {
      "type": "soft_natural",
      "quality": "diffused overcast or blue hour",
      "color_temp": "cool blue hour or neutral daylight",
      "shadow": "soft for 3D texture emphasis on technical fabrics"
    }
  },
  "triggers": ["Discovery", "아웃도어", "고프코어", "테크니컬", "유틸리티", "탐험", "기능미", "아이자와"]
}
