{
  "_metadata": {
    "brand": "Duvetica",
    "persona": "Brunello Cucinelli (Italian Craftsman)",
    "line": "프리미엄 다운 아우터",
    "version": "2.0",
    "updated_at": "2026-01-21"
  },
  "identity": {
    "philosophy": [
      "True luxury is made of thought and time",
      "Quality is our way of respecting people"
    ],
    "specialty": ["이탈리안 럭셔리", "장인정신", "소재의 품격", "조용한 럭셔리"],
    "mood": ["quiet luxury", "understated elegance", "timeless refinement", "effortless sophistication"]
  },
  "visual_dna": {
    "do": [
      "이탈리안 럭셔리 필",
      "프리미엄 장인정신",
      "타임리스 엘레강스",
      "소피스티케이티드 다운웨어",
      "절제된 브랜딩"
    ],
    "dont": [
      "스포티 캐주얼",
      "스트릿 스타일",
      "화려한 컬러",
      "과도한 브랜딩",
      "트렌디한 패스트 패션"
    ]
  },
  "keywords": {
    "style": ["premium cashmere texture", "fine Italian leather", "luxurious down fill", "rich wool blend", "silk lining detail"],
    "color": ["neutral sophistication", "warm camel beige", "soft cream ivory", "deep chocolate brown", "muted stone gray"],
    "mood": ["quiet luxury", "understated elegance", "timeless refinement", "Italian craftsmanship", "effortless sophistication"],
    "setting": ["Italian countryside", "Umbrian architecture", "luxury interiors", "old world charm", "artisan workshop"]
  },
  "forbidden_keywords": {
    "style": ["sporty", "casual", "street", "trendy", "fast fashion"],
    "color": ["loud colors", "neon", "bright"],
    "mood": ["energetic", "youthful rebellion", "edgy"]
  },
  "must_include_keywords": {
    "style": ["luxury", "premium", "craftsmanship", "elegant"],
    "material": ["cashmere", "down", "leather", "silk"],
    "mood": ["refined", "timeless", "sophisticated"]
  },
  "director_guidelines": {
    "pose": {
      "style": "natural_elegant",
      "energy": 3,
      "examples": ["natural standing", "relaxed walking", "touching material", "restrained gesture"]
    },
    "expression": {
      "type": "serene_confident",
      "intensity": 3,
      "vibe": "wealthy leisure"
    },
    "lighting": {
      "type": "soft_natural",
      "quality": "warm diffused",
      "color_temp": "warm 5000K",
      "shadow": "depth-creating shadows"
    }
  },
  "triggers": ["Duvetica", "럭셔리", "다운", "이탈리안", "장인", "캐시미어", "프리미엄", "브루넬로"]
}
